<?xml version="1.0"?>
<!DOCTYPE navigation
  PUBLIC "-//Apache Software Foundation//DTD Cactus Navigation V1.0//EN"
  "file:../../dtds/navigation-v10.dtd">

<navigation title="Running Tests" index="howto_runner">

  <menu label="Main Page" id="index"/>

  <menu label="Running Tests">
    <item id="howto_runner" label="Overview"/>
  </menu>

  <menu label="Integrations">
    <item id="integration_manual" label="Manual"/>
    <item id="integration_ant" label="Ant"/>
    <item id="integration_eclipse" label="Eclipse"/>
    <item id="integration_jetty" label="Jetty"/>
    <item id="integration_browser" label="Browser"/>
    <item id="howto_tomcat" label="Tomcat"/>
    <item id="integration_maven" label="Maven"/>
    <item id="howto_ide" label="Various IDEs"/>
    <item id="howto_junitee" label="JUnitEE"/>
  </menu>

</navigation>
